{
  "$schema": "https://json-schema.org/draft/2020-12/schema",
  "$id": "urn:aivss:report:1.0",
  "title": "AIVSS 1.0 Assessment Report",
  "type": "object",
  "additionalProperties": false,
  "required": [
    "aivss_version",
    "report_schema_version",
    "rubric_version",
    "calculator_version",
    "specification_status",
    "finding_id",
    "path_id",
    "risk_category",
    "agentic_applicability",
    "cvss",
    "scores",
    "provenance"
  ],
  "properties": {
    "aivss_version": {"const": "1.0"},
    "report_schema_version": {"const": "1.0"},
    "rubric_version": {"const": "1.0.0"},
    "calculator_version": {"const": "1.0.0"},
    "specification_status": {"const": "candidate"},
    "finding_id": {"type": "string", "minLength": 1},
    "path_id": {"type": "string", "minLength": 1},
    "title": {"type": "string", "minLength": 1},
    "summary": {"type": "string", "minLength": 1},
    "risk_category": {"$ref": "#/$defs/riskCategory"},
    "agentic_applicability": {"$ref": "#/$defs/agenticApplicability"},
    "cvss": {"$ref": "#/$defs/cvss"},
    "agentic_ai_profile": {"$ref": "#/$defs/agenticProfile"},
    "scores": {"$ref": "#/$defs/scores"},
    "provenance": {"$ref": "#/$defs/provenance"},
    "decision": {"$ref": "#/$defs/decision"},
    "priority": {"$ref": "#/$defs/priority"}
  },
  "$defs": {
    "score": {"type": "number", "minimum": 0, "maximum": 10},
    "nullableScore": {
      "oneOf": [
        {"$ref": "#/$defs/score"},
        {"type": "null"}
      ]
    },
    "riskCategory": {
      "type": "object",
      "additionalProperties": false,
      "required": ["id", "name"],
      "properties": {
        "id": {"type": "string", "pattern": "^ASI(0[1-9]|10)$"},
        "name": {"type": "string", "minLength": 1}
      }
    },
    "agenticApplicability": {
      "type": "object",
      "additionalProperties": false,
      "required": [
        "model_directed_goal_pursuit",
        "action_selection_or_sequencing",
        "rationale",
        "evidence_refs"
      ],
      "properties": {
        "model_directed_goal_pursuit": {"const": true},
        "action_selection_or_sequencing": {"const": true},
        "rationale": {"type": "string", "minLength": 1},
        "evidence_refs": {
          "type": "array",
          "minItems": 1,
          "items": {"type": "string", "minLength": 1}
        }
      }
    },
    "cvss": {
      "type": "object",
      "additionalProperties": false,
      "required": ["vector", "macrovector", "cvss_bte"],
      "properties": {
        "vector": {
          "type": "string",
          "pattern": "^CVSS:4\\.0(?:/(?!LC:|CP:|AP:|SR:|EX:|PT:|CA:|TD:)[A-Z][A-Z0-9]*:[A-Za-z]+)+$"
        },
        "macrovector": {"type": "string", "pattern": "^[0-2]{6}$"},
        "cvss_bte": {"$ref": "#/$defs/score"}
      }
    },
    "evidenceRecord": {
      "type": "object",
      "additionalProperties": false,
      "required": ["rationale", "evidence_refs"],
      "properties": {
        "rationale": {"type": "string", "minLength": 1},
        "evidence_refs": {
          "type": "array",
          "minItems": 1,
          "items": {"type": "string", "minLength": 1}
        },
        "method": {
          "enum": [
            "deterministic-proof",
            "empirical",
            "insufficient-evidence"
          ]
        },
        "deterministic_outcome": {"enum": ["success", "failure", null]},
        "successes": {"type": ["integer", "null"], "minimum": 0},
        "episodes": {"type": ["integer", "null"], "minimum": 1},
        "retry_budget": {"type": ["integer", "null"], "minimum": 1},
        "production_equivalent": {"type": ["boolean", "null"]},
        "budget_enforced": {"type": ["boolean", "null"]},
        "independent": {"type": ["boolean", "null"]},
        "lower_bound": {"type": ["number", "null"], "minimum": 0, "maximum": 1},
        "upper_bound": {"type": ["number", "null"], "minimum": 0, "maximum": 1},
        "ceiling_defined": {"type": ["boolean", "null"]},
        "coverage_complete": {"type": ["boolean", "null"]},
        "fail_closed": {"type": ["boolean", "null"]},
        "bypass_demonstrated": {"type": ["boolean", "null"]},
        "retrieval_tested": {"type": ["boolean", "null"]},
        "ordered_actions_reconstructable": {"type": ["boolean", "null"]},
        "affected_principals_bounded": {"type": ["boolean", "null"]},
        "required_fields_complete": {"type": ["boolean", "null"]},
        "integrity_protected": {"type": ["boolean", "null"]},
        "retention_verified": {"type": ["boolean", "null"]}
      }
    },
    "metricEvidence": {
      "type": "object",
      "additionalProperties": false,
      "required": ["value", "label", "evidence"],
      "properties": {
        "value": {"type": "string", "minLength": 1, "maxLength": 1},
        "label": {"type": "string", "minLength": 1},
        "evidence": {"$ref": "#/$defs/evidenceRecord"}
      }
    },
    "agenticProfile": {
      "type": "object",
      "additionalProperties": false,
      "required": [
        "vector",
        "metrics",
        "complete",
        "agentic_effect_class",
        "agentic_effect_class_label",
        "agentic_effect_class_status"
      ],
      "properties": {
        "vector": {
          "type": "string",
          "pattern": "^AIVSS:1\\.0/LC:(D|I|M|N|X)/CP:(C|S|N|X)/AP:(L|C|N|X)/SR:(R|P|U|X)/EX:(W|M|N|X)/PT:(H|M|L|X)/CA:(W|M|N|X)/TD:(H|M|L|X)$"
        },
        "metrics": {
          "type": "object",
          "additionalProperties": false,
          "required": ["LC", "CP", "AP", "SR", "EX", "PT", "CA", "TD"],
          "properties": {
            "LC": {"allOf": [{"$ref": "#/$defs/metricEvidence"}, {"properties": {"value": {"enum": ["D", "I", "M", "N", "X"]}}}]},
            "CP": {"allOf": [{"$ref": "#/$defs/metricEvidence"}, {"properties": {"value": {"enum": ["C", "S", "N", "X"]}}}]},
            "AP": {"allOf": [{"$ref": "#/$defs/metricEvidence"}, {"properties": {"value": {"enum": ["L", "C", "N", "X"]}}}]},
            "SR": {"allOf": [{"$ref": "#/$defs/metricEvidence"}, {"properties": {"value": {"enum": ["R", "P", "U", "X"]}}}]},
            "EX": {"allOf": [{"$ref": "#/$defs/metricEvidence"}, {"properties": {"value": {"enum": ["W", "M", "N", "X"]}}}]},
            "PT": {"allOf": [{"$ref": "#/$defs/metricEvidence"}, {"properties": {"value": {"enum": ["H", "M", "L", "X"]}}}]},
            "CA": {"allOf": [{"$ref": "#/$defs/metricEvidence"}, {"properties": {"value": {"enum": ["W", "M", "N", "X"]}}}]},
            "TD": {"allOf": [{"$ref": "#/$defs/metricEvidence"}, {"properties": {"value": {"enum": ["H", "M", "L", "X"]}}}]}
          }
        },
        "complete": {"type": "boolean"},
        "agentic_effect_class": {"enum": ["A0", "A1", "A2", "AX"]},
        "agentic_effect_class_label": {"type": "string", "minLength": 1},
        "agentic_effect_class_status": {"const": "candidate-unvalidated"}
      }
    },
    "mode1Score": {
      "type": "object",
      "additionalProperties": false,
      "required": ["aivss", "cvss_bte", "status", "basis"],
      "properties": {
        "aivss": {"$ref": "#/$defs/score"},
        "cvss_bte": {"$ref": "#/$defs/score"},
        "status": {"const": "normative"},
        "basis": {"type": "string", "minLength": 1}
      }
    },
    "scores": {
      "type": "object",
      "additionalProperties": false,
      "required": ["mode1_interpretation"],
      "properties": {
        "mode1_interpretation": {"$ref": "#/$defs/mode1Score"}
      }
    },
    "provenance": {
      "type": "object",
      "additionalProperties": false,
      "required": ["assessor", "assessor_kind", "tool", "tool_version", "assessed_at"],
      "properties": {
        "assessor": {
          "oneOf": [
            {"type": "string", "minLength": 1},
            {"type": "null"}
          ]
        },
        "assessor_kind": {"enum": ["human", "scanner", "llm_assisted", "imported"]},
        "tool": {
          "oneOf": [
            {"type": "string", "minLength": 1},
            {"type": "null"}
          ]
        },
        "tool_version": {
          "oneOf": [
            {"type": "string", "minLength": 1},
            {"type": "null"}
          ]
        },
        "assessed_at": {
          "type": "string",
          "pattern": "^[0-9]{4}-[0-9]{2}-[0-9]{2}T[0-9]{2}:[0-9]{2}:[0-9]{2}(\\.[0-9]+)?(Z|[+-][0-9]{2}:[0-9]{2})$"
        }
      }
    },
    "decisionPoints": {
      "type": "object",
      "additionalProperties": false,
      "required": [
        "in_kev",
        "publicly_exposed",
        "publicly_exposed_source",
        "decision_data_observed_at",
        "automatable",
        "automatable_source",
        "technical_impact",
        "technical_impact_source",
        "agentic_effect_class",
        "td"
      ],
      "properties": {
        "in_kev": {"type": "boolean"},
        "publicly_exposed": {"type": "boolean"},
        "publicly_exposed_source": {"type": "string", "minLength": 1},
        "decision_data_observed_at": {
          "type": "string",
          "pattern": "^[0-9]{4}-[0-9]{2}-[0-9]{2}T[0-9]{2}:[0-9]{2}:[0-9]{2}(\\.[0-9]+)?(Z|[+-][0-9]{2}:[0-9]{2})$"
        },
        "automatable": {"type": "boolean"},
        "automatable_source": {
          "enum": [
            "CISA Vulnrichment",
            "supplied",
            "BOD 26-04 default (no)",
            "CISA BOD 26-04 FAQ (missing metadata)"
          ]
        },
        "technical_impact": {"enum": ["partial", "total"]},
        "technical_impact_source": {
          "enum": [
            "CISA Vulnrichment",
            "supplied",
            "BOD 26-04 default (total)",
            "CISA BOD 26-04 FAQ (missing metadata)"
          ]
        },
        "agentic_effect_class": {"enum": ["A0", "A1", "A2", "AX"]},
        "td": {"enum": ["H", "M", "L", "X"]}
      }
    },
    "exploitation": {
      "type": "object",
      "additionalProperties": false,
      "required": ["rung", "rationale", "state", "authoritative", "epss", "epss_date"],
      "properties": {
        "rung": {"enum": ["cisa_kev", "vulnrichment_active", "observed_local", "poc", "none"]},
        "rationale": {"type": "string", "minLength": 1},
        "state": {
          "enum": [
            "known_exploited",
            "active_reported",
            "active_observed_local",
            "poc",
            "no_evidence_supplied"
          ]
        },
        "authoritative": {"type": "boolean"},
        "epss": {"type": ["number", "null"], "minimum": 0, "maximum": 1},
        "epss_date": {"type": ["string", "null"]}
      }
    },
    "decision": {
      "type": "object",
      "additionalProperties": false,
      "required": [
        "exploitation",
        "cve_id",
        "ssvc",
        "fceb_bod_2604_scope",
        "bod_2604_model_version",
        "bod_2604_decision_table",
        "bod_2604_model_source",
        "bod_2604_directive",
        "decision_basis",
        "compliance_applicable",
        "decision_points",
        "aivss_recommended_timeline",
        "aivss_recommended_label",
        "overlay_triggered",
        "escalated",
        "aivss_recommended_forensic_triage_indicated",
        "overlay_status",
        "note"
      ],
      "properties": {
        "exploitation": {"$ref": "#/$defs/exploitation"},
        "ssvc": {
          "type": "object",
          "additionalProperties": false,
          "required": [
            "methodology",
            "methodology_url",
            "decision_table",
            "outcome_namespace",
            "decision_table_source",
            "decision_point_namespaces",
            "extension_note"
          ],
          "properties": {
            "methodology": {"type": "string"},
            "methodology_url": {"const": "https://certcc.github.io/SSVC/"},
            "decision_table": {"const": "cisa:DT_BOD2604:1.0.0"},
            "outcome_namespace": {"const": "cisa:BOD2604:1.0.0"},
            "decision_table_source": {
              "const": "https://certcc.github.io/SSVC/howto/cisa_response/"
            },
            "decision_point_namespaces": {"type": "object"},
            "extension_note": {"type": "string"}
          }
        },
        "cve_id": {
          "oneOf": [
            {"type": "string", "pattern": "^CVE-[0-9]{4}-[0-9]{4,}$"},
            {"type": "null"}
          ]
        },
        "fceb_bod_2604_scope": {"type": "boolean"},
        "bod_2604_model_version": {"const": "cisa:BOD2604:1.0.0"},
        "bod_2604_decision_table": {"const": "cisa:DT_BOD2604:1.0.0"},
        "bod_2604_model_source": {
          "const": "https://certcc.github.io/SSVC/howto/cisa_response/"
        },
        "bod_2604_directive": {
          "const": "https://www.cisa.gov/news-events/directives/bod-26-04-prioritizing-security-updates-based-risk"
        },
        "decision_basis": {
          "enum": [
            "cisa_bod_26_04",
            "informative_bod_26_04_cve_guidance",
            "informative_bod_26_04_analogy"
          ]
        },
        "compliance_applicable": {"type": "boolean"},
        "decision_points": {"$ref": "#/$defs/decisionPoints"},
        "bod_2604_timeline": {"enum": ["FSU", "60D", "14D", "3D", "3DF"]},
        "bod_2604_label": {"type": "string"},
        "bod_2604_guidance_timeline": {"enum": ["FSU", "60D", "14D", "3D", "3DF"]},
        "bod_2604_guidance_label": {"type": "string"},
        "bod_2604_analogy_timeline": {"enum": ["FSU", "60D", "14D", "3D", "3DF"]},
        "bod_2604_analogy_label": {"type": "string"},
        "aivss_recommended_timeline": {
          "enum": ["FSU", "60D", "14D", "3D", "3DF", null]
        },
        "aivss_recommended_label": {"type": ["string", "null"]},
        "overlay_triggered": {"type": ["boolean", "null"]},
        "escalated": {"type": ["boolean", "null"]},
        "forensic_triage_required": {"type": "boolean"},
        "forensic_triage_indicated": {"type": "boolean"},
        "aivss_recommended_forensic_triage_indicated": {
          "type": ["boolean", "null"]
        },
        "overlay_status": {
          "enum": ["experimental-uncalibrated", "incomplete", "not-assessed"]
        },
        "note": {"type": "string", "minLength": 1}
      },
      "oneOf": [
        {
          "required": [
            "bod_2604_timeline",
            "bod_2604_label",
            "forensic_triage_required"
          ],
          "properties": {
            "decision_basis": {"const": "cisa_bod_26_04"},
            "compliance_applicable": {"const": true},
            "fceb_bod_2604_scope": {"const": true},
            "cve_id": {"type": "string"}
          },
          "not": {
            "anyOf": [
              {"required": ["bod_2604_guidance_timeline"]},
              {"required": ["bod_2604_guidance_label"]},
              {"required": ["bod_2604_analogy_timeline"]},
              {"required": ["bod_2604_analogy_label"]},
              {"required": ["forensic_triage_indicated"]}
            ]
          }
        },
        {
          "required": [
            "bod_2604_guidance_timeline",
            "bod_2604_guidance_label",
            "forensic_triage_indicated"
          ],
          "properties": {
            "decision_basis": {"const": "informative_bod_26_04_cve_guidance"},
            "compliance_applicable": {"const": false},
            "fceb_bod_2604_scope": {"const": false},
            "cve_id": {"type": "string"}
          },
          "not": {
            "anyOf": [
              {"required": ["bod_2604_timeline"]},
              {"required": ["bod_2604_label"]},
              {"required": ["bod_2604_analogy_timeline"]},
              {"required": ["bod_2604_analogy_label"]},
              {"required": ["forensic_triage_required"]}
            ]
          }
        },
        {
          "required": [
            "bod_2604_analogy_timeline",
            "bod_2604_analogy_label",
            "forensic_triage_indicated"
          ],
          "properties": {
            "decision_basis": {"const": "informative_bod_26_04_analogy"},
            "compliance_applicable": {"const": false},
            "fceb_bod_2604_scope": {"const": false},
            "cve_id": {"type": "null"}
          },
          "not": {
            "anyOf": [
              {"required": ["bod_2604_timeline"]},
              {"required": ["bod_2604_label"]},
              {"required": ["bod_2604_guidance_timeline"]},
              {"required": ["bod_2604_guidance_label"]},
              {"required": ["forensic_triage_required"]}
            ]
          }
        }
      ],
      "allOf": [
        {
          "if": {
            "properties": {
              "overlay_status": {"const": "experimental-uncalibrated"}
            }
          },
          "then": {
            "properties": {
              "aivss_recommended_timeline": {"type": "string"},
              "aivss_recommended_label": {"type": "string"},
              "overlay_triggered": {"type": "boolean"},
              "escalated": {"type": "boolean"},
              "aivss_recommended_forensic_triage_indicated": {
                "type": "boolean"
              }
            }
          },
          "else": {
            "properties": {
              "aivss_recommended_timeline": {"type": "null"},
              "aivss_recommended_label": {"type": "null"},
              "overlay_triggered": {"type": "null"},
              "escalated": {"type": "null"},
              "aivss_recommended_forensic_triage_indicated": {
                "type": "null"
              }
            }
          }
        }
      ]
    },
    "priority": {
      "type": "object",
      "additionalProperties": false,
      "required": ["aivss_p", "band", "terms", "scope", "status"],
      "properties": {
        "aivss_p": {"type": "integer", "minimum": 0, "maximum": 100},
        "band": {"enum": ["Immediate", "This sprint", "Scheduled", "Backlog"]},
        "terms": {
          "type": "object",
          "additionalProperties": false,
          "required": [
            "severity_norm",
            "business_criticality",
            "reach",
            "likelihood"
          ],
          "properties": {
            "severity_norm": {"type": "number", "minimum": 0, "maximum": 1},
            "business_criticality": {"enum": [0.35, 0.65, 1.0]},
            "reach": {"enum": [0.35, 0.65, 1.0]},
            "likelihood": {"type": "number", "minimum": 0, "maximum": 1}
          }
        },
        "scope": {"const": "organization-internal; not comparable across organizations"},
        "status": {"const": "organization-local-uncalibrated"}
      }
    }
  }
}
