{
  "aivss_version": "1.0",
  "report_schema_version": "1.0",
  "rubric_version": "1.0.0",
  "calculator_version": "1.0.0",
  "specification_status": "candidate",
  "finding_id": "AIVSS-ASI06-001",
  "path_id": "AIVSS-ASI06-001-PATH-1",
  "risk_category": {
    "id": "ASI06",
    "name": "Memory & Context Poisoning"
  },
  "agentic_applicability": {
    "model_directed_goal_pursuit": true,
    "action_selection_or_sequencing": true,
    "rationale": "The synthetic fixture uses a model to pursue a delegated goal and select or sequence actions that affect its environment.",
    "evidence_refs": [
      "fixture://AIVSS-ASI06-001/agentic-applicability"
    ]
  },
  "cvss": {
    "vector": "CVSS:4.0/AV:N/AC:H/AT:N/PR:N/UI:N/VC:H/VI:L/VA:L/SC:H/SI:N/SA:N/E:P",
    "macrovector": "011110",
    "cvss_bte": 7.8
  },
  "scores": {
    "mode1_interpretation": {
      "aivss": 7.8,
      "cvss_bte": 7.8,
      "status": "normative",
      "basis": "AIVSS = CVSS-BTE. Agentic AI metrics are parallel metadata and do not modify the severity number."
    }
  },
  "provenance": {
    "assessor": "synthetic-reference-fixture",
    "assessor_kind": "imported",
    "tool": "aivss-calc",
    "tool_version": "1.0.0",
    "assessed_at": "2026-08-27T00:00:00Z"
  },
  "title": "Adversarial content in agent memory biases later sessions",
  "summary": "Poisoned context persists across sessions and influences future agent decisions.",
  "agentic_ai_profile": {
    "vector": "AIVSS:1.0/LC:D/CP:C/AP:L/SR:R/EX:W/PT:H/CA:M/TD:H",
    "metrics": {
      "LC": {
        "value": "D",
        "label": "Direct",
        "evidence": {
          "rationale": "Synthetic reference fact for AIVSS-ASI06-001: Attacker-supplied natural language reaches a privileged decision or tool-invocation path without mediation.",
          "evidence_refs": [
            "fixture://AIVSS-ASI06-001/lc"
          ]
        }
      },
      "CP": {
        "value": "C",
        "label": "Cross-session memory",
        "evidence": {
          "rationale": "Synthetic reference fact for AIVSS-ASI06-001: Attacker-controlled context or memory persists in durable stores \u2014 vector databases, long-term agent memory, episodic memory banks, RAG indexes, user profiles, or training/fine-tuning data \u2014 and remains reachable after the originating session ends.",
          "evidence_refs": [
            "fixture://AIVSS-ASI06-001/cp"
          ]
        }
      },
      "AP": {
        "value": "L",
        "label": "Lateral",
        "evidence": {
          "rationale": "Synthetic reference fact for AIVSS-ASI06-001: Compromised intent, instructions, memory, or authority crosses a trust boundary to other agents, other tenants, or downstream systems.",
          "evidence_refs": [
            "fixture://AIVSS-ASI06-001/ap"
          ]
        }
      },
      "SR": {
        "value": "R",
        "label": "Reliable",
        "evidence": {
          "rationale": "Synthetic reference fact for AIVSS-ASI06-001: A production-equivalent fixture records 30 successful independent episodes out of 30, each from clean state with the hard production budget of three attempts for one stable principal; the one-sided 95% Wilson lower bound is 0.917.",
          "evidence_refs": [
            "fixture://AIVSS-ASI06-001/sr"
          ],
          "method": "empirical",
          "successes": 30,
          "episodes": 30,
          "retry_budget": 3,
          "production_equivalent": true,
          "budget_enforced": true,
          "independent": true,
          "lower_bound": 0.9172621864014352,
          "upper_bound": 1.0
        }
      },
      "EX": {
        "value": "W",
        "label": "Wide",
        "evidence": {
          "rationale": "Synthetic reference fact for AIVSS-ASI06-001: A reachable extension is dynamic or unvetted, or its identity, callable operations, arguments, credentials, or authority are not independently constrained for the assessed deployment.",
          "evidence_refs": [
            "fixture://AIVSS-ASI06-001/ex"
          ]
        }
      },
      "PT": {
        "value": "H",
        "label": "High deficit",
        "evidence": {
          "rationale": "Synthetic reference fact for AIVSS-ASI06-001: Runtime routing can select an unapproved provider and unpinned model, so no enforceable provider/model identifier or artifact integrity claim exists for this path.",
          "evidence_refs": [
            "fixture://AIVSS-ASI06-001/pt"
          ]
        }
      },
      "CA": {
        "value": "M",
        "label": "Moderate",
        "evidence": {
          "rationale": "Synthetic reference fact for AIVSS-ASI06-001: A finite hard request ceiling is enforced, but its aggregate coverage across a stable principal and tenant is incomplete.",
          "evidence_refs": [
            "fixture://AIVSS-ASI06-001/ca"
          ],
          "ceiling_defined": true,
          "coverage_complete": false,
          "fail_closed": true,
          "bypass_demonstrated": false
        }
      },
      "TD": {
        "value": "H",
        "label": "High deficit",
        "evidence": {
          "rationale": "Synthetic reference fact for AIVSS-ASI06-001: A retrieval test cannot reconstruct ordered actions or bound affected principals.",
          "evidence_refs": [
            "fixture://AIVSS-ASI06-001/td"
          ],
          "retrieval_tested": true,
          "ordered_actions_reconstructable": false,
          "affected_principals_bounded": false,
          "required_fields_complete": false,
          "integrity_protected": false,
          "retention_verified": false
        }
      }
    },
    "complete": true,
    "agentic_effect_class": "A2",
    "agentic_effect_class_label": "Substantial classifying interaction",
    "agentic_effect_class_status": "candidate-unvalidated"
  },
  "decision": {
    "exploitation": {
      "rung": "poc",
      "rationale": "Public or private proof-of-concept exists",
      "state": "poc",
      "authoritative": false,
      "epss": null,
      "epss_date": null
    },
    "cve_id": null,
    "fceb_bod_2604_scope": false,
    "ssvc": {
      "methodology": "Stakeholder-Specific Vulnerability Categorization (SSVC)",
      "methodology_url": "https://certcc.github.io/SSVC/",
      "decision_table": "cisa:DT_BOD2604:1.0.0",
      "outcome_namespace": "cisa:BOD2604:1.0.0",
      "decision_table_source": "https://certcc.github.io/SSVC/howto/cisa_response/",
      "decision_point_namespaces": {
        "in_kev": "cisa:KEV:1.0.0",
        "publicly_exposed": "cisa:PE:1.0.0",
        "automatable": "ssvc:A:2.0.0",
        "technical_impact": "ssvc:TI:1.0.0",
        "agentic_ai_effect_class": "aivss:effect_class:1.0.0"
      },
      "extension_note": "Agentic AI Effect Class is a transparent fifth SSVC extension input; TD (Traceability Deficit) is recorded but does not modify the BOD outcome."
    },
    "bod_2604_model_version": "cisa:BOD2604:1.0.0",
    "bod_2604_decision_table": "cisa:DT_BOD2604:1.0.0",
    "bod_2604_model_source": "https://certcc.github.io/SSVC/howto/cisa_response/",
    "bod_2604_directive": "https://www.cisa.gov/news-events/directives/bod-26-04-prioritizing-security-updates-based-risk",
    "decision_basis": "informative_bod_26_04_analogy",
    "compliance_applicable": false,
    "decision_points": {
      "in_kev": false,
      "publicly_exposed": true,
      "publicly_exposed_source": "synthetic deployment inventory fixture",
      "decision_data_observed_at": "2026-08-27T00:00:00Z",
      "automatable": true,
      "automatable_source": "supplied",
      "technical_impact": "total",
      "technical_impact_source": "supplied",
      "agentic_effect_class": "A2",
      "td": "H"
    },
    "aivss_recommended_timeline": "3D",
    "aivss_recommended_label": "Remediate within 3 days",
    "overlay_triggered": true,
    "escalated": false,
    "aivss_recommended_forensic_triage_indicated": false,
    "overlay_status": "experimental-uncalibrated",
    "bod_2604_analogy_timeline": "3D",
    "bod_2604_analogy_label": "Remediate within 3 days",
    "forensic_triage_indicated": false,
    "note": "This non-CVE result is an informative analogy, not a BOD 26-04 compliance deadline. Inputs were supplied explicitly."
  }
}
